ori,agency_name,agency_id,state_abbr,division_name,region_name,region_desc,county_name,agency_type_name,nibrs,nibrs_start_date,latitude,longitude
NY0010000,Albany County Sheriff's Office,12938,NY,Middle Atlantic,Northeast,Region I,ALBANY,County,False,,42.639824,-73.96267
NY0010100,Albany Police Department,12939,NY,Middle Atlantic,Northeast,Region I,ALBANY,City,True,2020-11-01T00:00:00.000Z,42.588272,-73.974015
NY0010200,Cohoes Police Department,12940,NY,Middle Atlantic,Northeast,Region I,ALBANY,City,False,,42.774536,-73.700066
NY0010300,Watervliet Police Department,12941,NY,Middle Atlantic,Northeast,Region I,ALBANY,City,False,,42.725674,-73.69997
NY0012000,Green Island Village Police Department,12942,NY,Middle Atlantic,Northeast,Region I,ALBANY,City,False,,42.74209,-73.69237
NY0012100,Altamont Village Police Department,12943,NY,Middle Atlantic,Northeast,Region I,ALBANY,City,False,,42.588272,-73.974015
NY0012500,Menands Village Police Department,12945,NY,Middle Atlantic,Northeast,Region I,ALBANY,City,False,,42.690357,-73.725815
NY0015100,Bethlehem Town Police Department,12946,NY,Middle Atlantic,Northeast,Region I,ALBANY,City,True,2021-01-01T00:00:00.000Z,42.588272,-73.974015
NY0015200,Guilderland Town Police Department,12947,NY,Middle Atlantic,Northeast,Region I,ALBANY,City,False,,42.588272,-73.974015
NY0015300,Colonie Town Police Department,12948,NY,Middle Atlantic,Northeast,Region I,ALBANY,City,True,2021-01-01T00:00:00.000Z,42.588272,-73.974015
NY0015500,State Park:,29175,NY,Middle Atlantic,Northeast,Region I,NOT SPECIFIED,Other State Agency,False,,,
NY0015800,Coeymans Town Police Department,12950,NY,Middle Atlantic,Northeast,Region I,ALBANY,City,False,,42.46919,-73.80931
NY0020000,Allegany County Sheriff's Office,12951,NY,Middle Atlantic,Northeast,Region I,ALLEGANY,County,False,,42.247871,-78.026115
NY0022000,Alfred Village Police Department,12952,NY,Middle Atlantic,Northeast,Region I,ALLEGANY,City,False,,42.253975,-77.79123
NY0022100,Amity Town and Belmont Village Police Department,12964,NY,Middle Atlantic,Northeast,Region I,ALLEGANY,City,False,,42.247871,-78.026115
NY0022200,Andover Village Police Department,12953,NY,Middle Atlantic,Northeast,Region I,ALLEGANY,City,False,,42.247871,-78.026115
NY0022300,Angelica Village  Police Department,12954,NY,Middle Atlantic,Northeast,Region I,ALLEGANY,City,False,,42.247871,-78.026115
NY0022400,Bolivar Village Police Department,12955,NY,Middle Atlantic,Northeast,Region I,ALLEGANY,City,False,,42.067944,-78.1674
NY0022600,Cuba Town Police Department,12957,NY,Middle Atlantic,Northeast,Region I,ALLEGANY,City,False,,42.21543,-78.28183
NY0022800,Wellsville Village Police Department,12959,NY,Middle Atlantic,Northeast,Region I,ALLEGANY,City,False,,42.11885,-77.94299
NY0025000,Friendship Town Police Department,12963,NY,Middle Atlantic,Northeast,Region I,ALLEGANY,City,False,,42.247871,-78.026115
NY0027000,Independence Town Police Department,12966,NY,Middle Atlantic,Northeast,Region I,ALLEGANY,City,False,,42.03696,-77.76822
NY0030000,Broome County Sheriff's Office,12968,NY,Middle Atlantic,Northeast,Region I,BROOME,County,True,2020-01-01T00:00:00.000Z,42.132046,-75.914276
NY0030100,Binghamton Police Department,12969,NY,Middle Atlantic,Northeast,Region I,BROOME,City,True,2019-01-01T00:00:00.000Z,42.097076,-75.911995
NY0030200,Endicott Village Police Department,12970,NY,Middle Atlantic,Northeast,Region I,BROOME,City,True,2019-01-01T00:00:00.000Z,42.161977,-75.830283
NY0030300,Johnson City Village Police Department,12971,NY,Middle Atlantic,Northeast,Region I,BROOME,City,True,2019-01-01T00:00:00.000Z,42.115253,-75.95462
NY0032000,Port Dickinson Village Police Department,12973,NY,Middle Atlantic,Northeast,Region I,BROOME,City,False,,42.138203,-75.89554
NY0036400,Vestal Town Police Department,12976,NY,Middle Atlantic,Northeast,Region I,BROOME,City,True,2019-01-01T00:00:00.000Z,42.161977,-75.830283
NY0040000,Cattaraugus County Sheriff's Office,12978,NY,Middle Atlantic,Northeast,Region I,CATTARAUGUS,County,True,2020-12-01T00:00:00.000Z,42.25149,-78.80058
NY0040100,Olean Police Department,12979,NY,Middle Atlantic,Northeast,Region I,CATTARAUGUS,City,True,2021-01-01T00:00:00.000Z,42.077515,-78.42975
NY0042000,Allegany Village Police Department,12980,NY,Middle Atlantic,Northeast,Region I,CATTARAUGUS,City,False,,42.239169,-78.662421
NY0042300,Ellicottville Police Department,12981,NY,Middle Atlantic,Northeast,Region I,CATTARAUGUS,City,False,,42.239169,-78.662421
NY0042400,Franklinville Village Police Department,12982,NY,Middle Atlantic,Northeast,Region I,CATTARAUGUS,City,False,,42.239169,-78.662421
NY0042600,Cattaraugus Village Police Department,12984,NY,Middle Atlantic,Northeast,Region I,CATTARAUGUS,City,False,,42.329826,-78.86864
NY0042800,Portville Village Police Department,12985,NY,Middle Atlantic,Northeast,Region I,CATTARAUGUS,City,False,,42.239169,-78.662421
NY0043300,Salamanca Police Department,12988,NY,Middle Atlantic,Northeast,Region I,CATTARAUGUS,City,False,,42.239169,-78.662421
NY0049000,State Park: Allegany Region,12991,NY,Middle Atlantic,Northeast,Region I,NOT SPECIFIED,Other State Agency,False,,42.239169,-78.662421
NY0050000,Cayuga County Sheriff's Office,12992,NY,Middle Atlantic,Northeast,Region I,CAYUGA,County,True,2019-12-01T00:00:00.000Z,42.977413,-76.54245
NY0050100,Auburn Police Department,12993,NY,Middle Atlantic,Northeast,Region I,CAYUGA,City,True,2020-01-01T00:00:00.000Z,42.934895,-76.56634
NY0052100,Weedsport Village Police Department,12995,NY,Middle Atlantic,Northeast,Region I,CAYUGA,City,False,,43.047684,-76.56141
NY0052200,Port Byron Village Police Department,12996,NY,Middle Atlantic,Northeast,Region I,CAYUGA,City,False,,43.008546,-76.574587
NY0052600,Moravia Village Police Department,12997,NY,Middle Atlantic,Northeast,Region I,CAYUGA,City,False,,43.008546,-76.574587
NY0060000,Chautauqua County Sheriff's Office,12999,NY,Middle Atlantic,Northeast,Region I,CHAUTAUQUA,County,True,2020-07-01T00:00:00.000Z,42.254875,-79.503944
NY0060100,Dunkirk Police Department,13000,NY,Middle Atlantic,Northeast,Region I,CHAUTAUQUA,City,True,2020-08-01T00:00:00.000Z,42.304216,-79.407595
NY0060200,Jamestown Police Department,13001,NY,Middle Atlantic,Northeast,Region I,CHAUTAUQUA,City,True,2019-01-01T00:00:00.000Z,42.096424,-79.236565
NY0062000,Lakewood-Busti Police Department,13002,NY,Middle Atlantic,Northeast,Region I,CHAUTAUQUA,City,True,2020-07-01T00:00:00.000Z,42.103367,-79.32411
NY0062900,Fredonia Village Police Department,13009,NY,Middle Atlantic,Northeast,Region I,CHAUTAUQUA,City,True,2020-07-01T00:00:00.000Z,42.440598,-79.33228
NY0063200,Westfield Village Police Department,13012,NY,Middle Atlantic,Northeast,Region I,CHAUTAUQUA,City,True,2020-08-01T00:00:00.000Z,42.304216,-79.407595
NY0065200,Carroll Town Police Department,13016,NY,Middle Atlantic,Northeast,Region I,CHAUTAUQUA,City,True,2020-07-01T00:00:00.000Z,42.304216,-79.407595
NY0065900,Ellicott Town Police Department,13017,NY,Middle Atlantic,Northeast,Region I,CHAUTAUQUA,City,True,2020-07-01T00:00:00.000Z,42.120502,-79.20066
NY0070000,Chemung County Sheriff's Office,13021,NY,Middle Atlantic,Northeast,Region I,CHEMUNG,County,False,,42.091446,-76.800964
NY0070100,Elmira Police Department,13022,NY,Middle Atlantic,Northeast,Region I,CHEMUNG,City,False,,42.091324,-76.80329
NY0072100,Elmira Heights Village Police Department,13023,NY,Middle Atlantic,Northeast,Region I,CHEMUNG,City,False,,42.12821,-76.82175
NY0072200,Horseheads Village Police Department,13024,NY,Middle Atlantic,Northeast,Region I,CHEMUNG,City,False,,42.15528,-76.747179
NY0075500,Elmira Town Police Department,13026,NY,Middle Atlantic,Northeast,Region I,CHEMUNG,City,False,,42.077976,-76.84392
NY0080000,Chenango County Sheriff's Office,13028,NY,Middle Atlantic,Northeast,Region I,CHENANGO,County,False,,42.489732,-75.604905
NY0082000,Afton Village Police Department,13029,NY,Middle Atlantic,Northeast,Region I,CHENANGO,City,False,,42.489732,-75.604905
NY0082100,Bainbridge Village Police Department,13030,NY,Middle Atlantic,Northeast,Region I,CHENANGO,City,False,,42.294674,-75.48137
NY0082200,Greene Village Police Department,13031,NY,Middle Atlantic,Northeast,Region I,CHENANGO,City,False,,42.32981,-75.77092
NY0082400,Norwich Police Department,13033,NY,Middle Atlantic,Northeast,Region I,CHENANGO,City,True,2021-12-01T00:00:00.000Z,42.53143,-75.52138
NY0082500,Oxford Village Police Department,13034,NY,Middle Atlantic,Northeast,Region I,CHENANGO,City,False,,42.489732,-75.604905
NY0082700,Sherburne Village Police Department,13035,NY,Middle Atlantic,Northeast,Region I,CHENANGO,City,False,,42.489732,-75.604905
NY0082800,New Berlin Town Police Department,13036,NY,Middle Atlantic,Northeast,Region I,CHENANGO,City,False,,42.622704,-75.33214
NY0090000,Clinton County Sheriff's Office,13038,NY,Middle Atlantic,Northeast,Region I,CLINTON,County,False,,44.719185,-73.468605
NY0090100,Plattsburgh City Police Department,13039,NY,Middle Atlantic,Northeast,Region I,CLINTON,City,False,,44.692303,-73.45473
NY0100000,Columbia County Sheriff's Office,13044,NY,Middle Atlantic,Northeast,Region I,COLUMBIA,County,False,,42.249664,-73.75654
NY0100100,Hudson Police Department,13045,NY,Middle Atlantic,Northeast,Region I,COLUMBIA,City,True,2019-08-01T00:00:00.000Z,42.247728,-73.626803
NY0100200,Philmont Village Police Department,13046,NY,Middle Atlantic,Northeast,Region I,COLUMBIA,City,False,,42.24936,-73.648186
NY0100300,Greenport Town Police Department,13047,NY,Middle Atlantic,Northeast,Region I,COLUMBIA,City,False,,42.256104,-73.76002
NY0102000,Chatham Village Police Department,13051,NY,Middle Atlantic,Northeast,Region I,COLUMBIA,City,False,,42.363182,-73.59556
NY0102500,Stockport Town Police Department,13053,NY,Middle Atlantic,Northeast,Region I,COLUMBIA,City,False,,42.247728,-73.626803
NY0110000,Cortland County Sheriff's Office,13056,NY,Middle Atlantic,Northeast,Region I,CORTLAND,County,True,2021-07-01T00:00:00.000Z,42.597927,-76.175285
NY0110100,Cortland Police Department,13057,NY,Middle Atlantic,Northeast,Region I,CORTLAND,City,True,2021-10-01T00:00:00.000Z,42.599316,-76.1797
NY0112000,Homer Village Police Department,13058,NY,Middle Atlantic,Northeast,Region I,CORTLAND,City,True,2021-05-01T00:00:00.000Z,42.594039,-76.07624
NY0120000,Delaware County Sheriff's Office,13061,NY,Middle Atlantic,Northeast,Region I,DELAWARE,County,False,,42.193986,-74.966728
NY0122100,Delhi Village Police Department,13062,NY,Middle Atlantic,Northeast,Region I,DELAWARE,City,False,,42.193986,-74.966728
NY0122400,Hancock Village Police Department,13063,NY,Middle Atlantic,Northeast,Region I,DELAWARE,City,False,,41.955193,-75.269455
NY0122700,Sidney Village Police Department,13064,NY,Middle Atlantic,Northeast,Region I,DELAWARE,City,False,,42.316654,-75.390076
NY0122900,Walton Village Police Department,13065,NY,Middle Atlantic,Northeast,Region I,DELAWARE,City,False,,42.164715,-75.1354
NY0124200,Colchester Town Police Department,13066,NY,Middle Atlantic,Northeast,Region I,DELAWARE,City,False,,42.193986,-74.966728
NY0130000,Dutchess County Sheriff's Office,13067,NY,Middle Atlantic,Northeast,Region I,DUTCHESS,County,True,2021-01-01T00:00:00.000Z,41.710106,-73.920654
NY0130100,Beacon Police Department,13068,NY,Middle Atlantic,Northeast,Region I,DUTCHESS,City,True,2021-01-01T00:00:00.000Z,41.75501,-73.739951
NY0130200,Poughkeepsie Police Department,13069,NY,Middle Atlantic,Northeast,Region I,DUTCHESS,City,False,,41.7064,-73.92799
NY0132000,Fishkill Village Police Department,13072,NY,Middle Atlantic,Northeast,Region I,DUTCHESS,City,True,2021-10-01T00:00:00.000Z,41.53271,-73.90609
NY0132100,Millerton Village Police Department,25361,NY,Middle Atlantic,Northeast,Region I,DUTCHESS,City,False,,41.75501,-73.739951
NY0132400,Wappingers Falls Village Police Department,13074,NY,Middle Atlantic,Northeast,Region I,DUTCHESS,City,False,,41.59587,-73.91826
NY0132500,Red Hook Village Police Department,13075,NY,Middle Atlantic,Northeast,Region I,DUTCHESS,City,False,,41.75501,-73.739951
NY0132700,Rhinebeck Village Police Department,13077,NY,Middle Atlantic,Northeast,Region I,DUTCHESS,City,False,,41.927055,-73.908806
NY0132800,Millbrook Village Police Department,13078,NY,Middle Atlantic,Northeast,Region I,DUTCHESS,City,False,,41.75501,-73.739951
NY0135000,Pine Plains Town Police Department,13079,NY,Middle Atlantic,Northeast,Region I,DUTCHESS,City,False,,41.75501,-73.739951
NY0136300,Poughkeepsie Town Police Department,13081,NY,Middle Atlantic,Northeast,Region I,DUTCHESS,City,True,2021-01-01T00:00:00.000Z,41.70077,-73.88943
NY0136400,Fishkill Town Police Department,13082,NY,Middle Atlantic,Northeast,Region I,DUTCHESS,City,False,,41.75501,-73.739951
NY0136500,Hyde Park Town Police Department,13083,NY,Middle Atlantic,Northeast,Region I,DUTCHESS,City,True,2020-08-01T00:00:00.000Z,41.804367,-73.91172
NY0136600,East Fishkill Town Police Department,13084,NY,Middle Atlantic,Northeast,Region I,DUTCHESS,City,True,2021-04-01T00:00:00.000Z,41.55363,-73.79471
NY0139000,State Park: Taconic Region,13086,NY,Middle Atlantic,Northeast,Region I,NOT SPECIFIED,Other State Agency,False,,41.75501,-73.739951
NY0140000,Erie County Sheriff's Office,13087,NY,Middle Atlantic,Northeast,Region I,ERIE,County,False,,42.752759,-78.778192
NY0140100,Buffalo Police Department,13088,NY,Middle Atlantic,Northeast,Region I,ERIE,City,True,2020-10-01T00:00:00.000Z,42.965775,-78.74092
NY0140200,Lackawanna Police Department,13089,NY,Middle Atlantic,Northeast,Region I,ERIE,City,False,,42.825806,-78.82484
NY0140300,Tonawanda Police Department,13090,NY,Middle Atlantic,Northeast,Region I,ERIE,City,False,,43.018867,-78.886345
NY0140400,Kenmore Village Police Department,13091,NY,Middle Atlantic,Northeast,Region I,ERIE,City,True,2022-06-01T00:00:00.000Z,42.962654,-78.878716
NY0142200,East Aurora-Aurora Town Police Department,13093,NY,Middle Atlantic,Northeast,Region I,ERIE,City,False,,42.76101,-76.70471
NY0142400,Depew Village Police Department,13094,NY,Middle Atlantic,Northeast,Region I,ERIE,City,False,,42.904728,-78.68635
NY0142600,Gowanda Village Police Department,13096,NY,Middle Atlantic,Northeast,Region I,"CATTARAUGUS, ERIE",City,False,,42.462967,-78.93606
NY0142900,Blasdell Village Police Department,13099,NY,Middle Atlantic,Northeast,Region I,ERIE,City,False,,42.79794,-78.8298
NY0143000,Hamburg Village Police Department,13100,NY,Middle Atlantic,Northeast,Region I,ERIE,City,False,,42.71606,-78.83262
NY0143200,Akron Village Police Department,13102,NY,Middle Atlantic,Northeast,Region I,ERIE,City,False,,43.020176,-78.50191
NY0143700,Niagara Frontier Transportation Authority,31955,NY,Middle Atlantic,Northeast,Region I,ERIE,Other,False,,,
NY0145100,Amherst Town Police Department,13103,NY,Middle Atlantic,Northeast,Region I,ERIE,City,False,,43.017994,-78.782845
NY0145400,Brant Town Police Department,13106,NY,Middle Atlantic,Northeast,Region I,ERIE,City,False,,42.752759,-78.778192
NY0145500,Cheektowaga Town Police Department,13107,NY,Middle Atlantic,Northeast,Region I,ERIE,City,False,,42.903458,-78.75433
NY0146000,Orchard Park Town Police Department,13108,NY,Middle Atlantic,Northeast,Region I,ERIE,City,False,,42.7661,-78.74385
NY0146100,Eden Town Police Department,13109,NY,Middle Atlantic,Northeast,Region I,ERIE,City,False,,42.652393,-78.89419
NY0146300,Evans Town Police Department,13110,NY,Middle Atlantic,Northeast,Region I,ERIE,City,False,,42.63766,-79.027725
NY0146500,Hamburg Town Police Department,13112,NY,Middle Atlantic,Northeast,Region I,ERIE,City,False,,42.728985,-78.825615
NY0146700,Lancaster Town Police Department,13114,NY,Middle Atlantic,Northeast,Region I,ERIE,City,False,,42.929108,-78.622665
NY0147200,Tonawanda Town Police Department,13116,NY,Middle Atlantic,Northeast,Region I,ERIE,City,False,,42.98086,-78.86628
NY0147400,West Seneca Town Police Department,13117,NY,Middle Atlantic,Northeast,Region I,ERIE,City,False,,42.832394,-78.753716
NY0150000,Essex County Sheriff's Office,13119,NY,Middle Atlantic,Northeast,Region I,ESSEX,County,False,,44.108971,-73.777573
NY0152300,Lake Placid Village Police Department,13121,NY,Middle Atlantic,Northeast,Region I,ESSEX,City,False,,44.108971,-73.777573
NY0152700,Ticonderoga Town Police Department,13122,NY,Middle Atlantic,Northeast,Region I,ESSEX,City,False,,44.108971,-73.777573
NY0155100,Moriah Town Police Department,13123,NY,Middle Atlantic,Northeast,Region I,ESSEX,City,False,,44.043102,-73.45808
NY0160000,Franklin County Sheriff's Office,13126,NY,Middle Atlantic,Northeast,Region I,FRANKLIN,County,False,,44.594376,-74.31067
NY0162000,Tupper Lake Village Police Department,13127,NY,Middle Atlantic,Northeast,Region I,FRANKLIN,City,False,,44.594376,-74.31067
NY0162300,Saranac Lake Village Police Department,13128,NY,Middle Atlantic,Northeast,Region I,"ESSEX, FRANKLIN",City,False,,44.326756,-74.131386
NY0162400,Malone Village Police Department,13129,NY,Middle Atlantic,Northeast,Region I,FRANKLIN,City,False,,44.850082,-74.28859
NY0170000,Fulton County Sheriff's Office,13131,NY,Middle Atlantic,Northeast,Region I,FULTON,County,False,,43.115609,-74.423678
NY0170100,Gloversville Police Department,13132,NY,Middle Atlantic,Northeast,Region I,FULTON,City,True,2022-02-01T00:00:00.000Z,43.050793,-74.348816
NY0170200,Johnstown Police Department,13133,NY,Middle Atlantic,Northeast,Region I,FULTON,City,True,2022-06-01T00:00:00.000Z,43.115609,-74.423678
NY0172100,Northville Village Police Department,13134,NY,Middle Atlantic,Northeast,Region I,FULTON,City,False,,43.115609,-74.423678
NY0180000,Genesee County Sheriff's Office,13136,NY,Middle Atlantic,Northeast,Region I,GENESEE,County,True,2019-01-01T00:00:00.000Z,43.012383,-78.2021
NY0180100,Batavia Police Department,13137,NY,Middle Atlantic,Northeast,Region I,GENESEE,City,True,2020-06-01T00:00:00.000Z,42.998146,-78.18762
NY0182300,Le Roy Village Police Department,13138,NY,Middle Atlantic,Northeast,Region I,GENESEE,City,True,2021-05-01T00:00:00.000Z,42.97761,-77.988976
NY0190000,Greene County Sheriff's Office,13140,NY,Middle Atlantic,Northeast,Region I,GREENE,County,False,,42.217846,-73.86338
NY0192000,Athens Village  Police Department,13141,NY,Middle Atlantic,Northeast,Region I,GREENE,City,False,,42.2625,-73.81121
NY0192100,Catskill Village Police Department,13142,NY,Middle Atlantic,Northeast,Region I,GREENE,City,False,,42.22232,-73.86779
NY0192200,Coxsackie Village Police Department,13143,NY,Middle Atlantic,Northeast,Region I,GREENE,City,False,,42.358818,-73.81303
NY0192500,Windham Town Police Department,13145,NY,Middle Atlantic,Northeast,Region I,GREENE,City,False,,42.286964,-74.149554
NY0195000,Hunter Town Police Department,13147,NY,Middle Atlantic,Northeast,Region I,GREENE,City,False,,42.286964,-74.149554
NY0195100,Durham Town Police Department,13148,NY,Middle Atlantic,Northeast,Region I,GREENE,City,False,,42.286964,-74.149554
NY0195200,Cairo Town Police Department,13149,NY,Middle Atlantic,Northeast,Region I,GREENE,City,False,,42.286964,-74.149554
NY0200000,Hamilton County Sheriff's Office,13150,NY,Middle Atlantic,Northeast,Region I,HAMILTON,County,False,,43.657879,-74.502456
NY0205000,Inlet Town Police Department,13151,NY,Middle Atlantic,Northeast,Region I,HAMILTON,City,False,,43.657879,-74.502456
NY0210000,Herkimer County Sheriff's Office,13152,NY,Middle Atlantic,Northeast,Region I,HERKIMER,County,False,,43.028564,-74.988914
NY0212100,Frankfort Village Police Department,13153,NY,Middle Atlantic,Northeast,Region I,HERKIMER,City,False,,43.03963,-75.06943
NY0212200,Ilion Village Police Department,13154,NY,Middle Atlantic,Northeast,Region I,HERKIMER,City,True,2020-12-01T00:00:00.000Z,43.014633,-75.03761
NY0212300,Mohawk Village Police Department,13155,NY,Middle Atlantic,Northeast,Region I,HERKIMER,City,False,,43.00903,-75.00515
NY0212400,Herkimer Village Police Department,13156,NY,Middle Atlantic,Northeast,Region I,HERKIMER,City,False,,43.02696,-74.98698
NY0212500,Dolgeville Village Police Department,13157,NY,Middle Atlantic,Northeast,Region I,"FULTON, HERKIMER",City,False,,43.103516,-74.77017
NY0212900,Little Falls Police Department,13158,NY,Middle Atlantic,Northeast,Region I,HERKIMER,City,False,,43.04471,-74.85576
NY0216700,Webb Town Police Department,13160,NY,Middle Atlantic,Northeast,Region I,HERKIMER,City,False,,43.571009,-74.841097
NY0216800,Frankfort Town Police Department,13161,NY,Middle Atlantic,Northeast,Region I,HERKIMER,City,False,,43.0387,-75.072685
NY0220000,Jefferson County Sheriff's Office,13162,NY,Middle Atlantic,Northeast,Region I,JEFFERSON,County,True,2020-07-01T00:00:00.000Z,43.995371,-76.053514
NY0220100,Watertown Police Department,13163,NY,Middle Atlantic,Northeast,Region I,JEFFERSON,City,True,2021-01-01T00:00:00.000Z,43.995371,-76.053514
NY0222000,Adams Village Police Department,13164,NY,Middle Atlantic,Northeast,Region I,JEFFERSON,City,False,,43.808777,-76.02422
NY0222100,Alexandria Bay Village Police Department,13165,NY,Middle Atlantic,Northeast,Region I,JEFFERSON,City,False,,43.995371,-76.053514
NY0222300,Brownville Village  Police Department,13166,NY,Middle Atlantic,Northeast,Region I,JEFFERSON,City,False,,43.981037,-75.89368
NY0222400,Dexter Village Police Department,13167,NY,Middle Atlantic,Northeast,Region I,JEFFERSON,City,False,,43.995371,-76.053514
NY0222500,Glen Park Village Police Department,13168,NY,Middle Atlantic,Northeast,Region I,JEFFERSON,City,False,,43.995371,-76.053514
NY0222600,Cape Vincent Village Police Department,13169,NY,Middle Atlantic,Northeast,Region I,JEFFERSON,City,False,,43.995371,-76.053514
NY0222700,West Carthage Village Police Department,13170,NY,Middle Atlantic,Northeast,Region I,JEFFERSON,City,False,,43.973236,-75.62325
NY0222800,Clayton Village Police Department,13171,NY,Middle Atlantic,Northeast,Region I,JEFFERSON,City,False,,43.995371,-76.053514
NY0223300,Sackets Harbor Village Police Department,13172,NY,Middle Atlantic,Northeast,Region I,JEFFERSON,City,False,,43.995371,-76.053514
NY0223400,Black River Police Department,13173,NY,Middle Atlantic,Northeast,Region I,JEFFERSON,City,False,,43.995371,-76.053514
NY0223700,Theresa Village Police Department,13174,NY,Middle Atlantic,Northeast,Region I,JEFFERSON,City,False,,44.213318,-75.79902
NY0223800,Carthage Village Police Department,13175,NY,Middle Atlantic,Northeast,Region I,JEFFERSON,City,False,,43.97707,-75.60746
NY0229000,State Park: Thousand Island Region,13179,NY,Middle Atlantic,Northeast,Region I,NOT SPECIFIED,Other State Agency,False,,44.33075,-75.91748
NY0240000,Lewis County Sheriff's Office,13184,NY,Middle Atlantic,Northeast,Region I,LEWIS,County,True,2021-01-01T00:00:00.000Z,43.782681,-75.44414
NY0242400,Lowville Village Police Department,13187,NY,Middle Atlantic,Northeast,Region I,LEWIS,City,False,,43.79684,-75.4833
NY0250000,Livingston County Sheriff's Office,13190,NY,Middle Atlantic,Northeast,Region I,LIVINGSTON,County,True,2021-01-01T00:00:00.000Z,42.800175,-77.81615
NY0252000,Avon Village Police Department,13191,NY,Middle Atlantic,Northeast,Region I,LIVINGSTON,City,False,,42.727485,-77.769779
NY0252100,Caledonia Village Police Department,13192,NY,Middle Atlantic,Northeast,Region I,LIVINGSTON,City,False,,42.727485,-77.769779
NY0252200,Geneseo Village Police Department,13193,NY,Middle Atlantic,Northeast,Region I,LIVINGSTON,City,False,,42.79529,-77.81701
NY0252600,Mount Morris Village Police Department,13194,NY,Middle Atlantic,Northeast,Region I,LIVINGSTON,City,False,,42.723648,-77.87283
NY0252700,Dansville Village Police Department,13195,NY,Middle Atlantic,Northeast,Region I,LIVINGSTON,City,False,,42.559494,-77.69501
NY0256000,Nunda Town and Village Police Department,13197,NY,Middle Atlantic,Northeast,Region I,LIVINGSTON,City,False,,42.727485,-77.769779
NY0260000,Madison County Sheriff's Office,13198,NY,Middle Atlantic,Northeast,Region I,MADISON,County,False,,42.910026,-75.663575
NY0260100,Oneida Police Department,13199,NY,Middle Atlantic,Northeast,Region I,MADISON,City,False,,43.09671,-75.65287
NY0262100,Cazenovia Village Police Department,13200,NY,Middle Atlantic,Northeast,Region I,MADISON,City,False,,42.929863,-75.8523
NY0262500,Hamilton Village Police Department,13201,NY,Middle Atlantic,Northeast,Region I,MADISON,City,False,,42.826935,-75.54349
NY0262600,Canastota Village Police Department,13202,NY,Middle Atlantic,Northeast,Region I,MADISON,City,False,,43.081123,-75.750786
NY0262900,Chittenango Village Police Department,13203,NY,Middle Atlantic,Northeast,Region I,MADISON,City,False,,43.04495,-75.86658
NY0270000,Monroe County Sheriff's Office,13205,NY,Middle Atlantic,Northeast,Region I,MONROE,County,True,2019-01-01T00:00:00.000Z,43.152992,-77.61453
NY0270100,Rochester Police Department,13206,NY,Middle Atlantic,Northeast,Region I,MONROE,City,True,2021-02-01T00:00:00.000Z,43.15193,-77.61099
NY0270200,Irondequoit Town Police Department,13207,NY,Middle Atlantic,Northeast,Region I,MONROE,City,True,2020-06-01T00:00:00.000Z,43.21119,-77.581154
NY0272400,East Rochester Village Police Department,13209,NY,Middle Atlantic,Northeast,Region I,MONROE,City,True,2020-01-01T00:00:00.000Z,43.11023,-77.49459
NY0272500,Fairport Village Police Department,13210,NY,Middle Atlantic,Northeast,Region I,MONROE,City,True,2019-11-01T00:00:00.000Z,43.100693,-77.441925
NY0272800,Brockport Village Police Department,13211,NY,Middle Atlantic,Northeast,Region I,MONROE,City,True,2019-05-01T00:00:00.000Z,43.464475,-77.664656
NY0275000,Brighton Town Police Department,13212,NY,Middle Atlantic,Northeast,Region I,MONROE,City,True,2020-01-01T00:00:00.000Z,43.126137,-77.574745
NY0275300,Gates Town Police Department,13213,NY,Middle Atlantic,Northeast,Region I,MONROE,City,True,2021-11-01T00:00:00.000Z,43.149868,-77.69255
